{
  "entities": [
    {
      "graph_entity_id": "g-entity-0001",
      "canonical_name": "林岚",
      "label": "person",
      "aliases": [
        "林岚"
      ],
      "source_entity_ids": [
        "ef-1"
      ],
      "source_runs": [
        "run-20260417-150000-demo"
      ],
      "last_seen_at": "2026-04-17T07:33:08+00:00"
    },
    {
      "graph_entity_id": "g-entity-0002",
      "canonical_name": "飞书",
      "label": "organization",
      "aliases": [
        "Lark",
        "飞书"
      ],
      "source_entity_ids": [
        "ef-2"
      ],
      "source_runs": [
        "run-20260417-150000-demo"
      ],
      "last_seen_at": "2026-04-17T07:33:08+00:00"
    },
    {
      "graph_entity_id": "g-entity-0003",
      "canonical_name": "研发负责人",
      "label": "role",
      "aliases": [
        "研发负责人"
      ],
      "source_entity_ids": [
        "ef-3"
      ],
      "source_runs": [
        "run-20260417-150000-demo"
      ],
      "last_seen_at": "2026-04-17T07:33:08+00:00"
    },
    {
      "graph_entity_id": "g-entity-0004",
      "canonical_name": "上海",
      "label": "location",
      "aliases": [
        "上海"
      ],
      "source_entity_ids": [
        "ef-4"
      ],
      "source_runs": [
        "run-20260417-150000-demo"
      ],
      "last_seen_at": "2026-04-17T07:33:08+00:00"
    },
    {
      "graph_entity_id": "g-entity-0005",
      "canonical_name": "上海发布会",
      "label": "event",
      "aliases": [
        "发布会"
      ],
      "source_entity_ids": [
        "ef-5"
      ],
      "source_runs": [
        "run-20260417-150000-demo"
      ],
      "last_seen_at": "2026-04-17T07:33:08+00:00"
    },
    {
      "graph_entity_id": "g-entity-0006",
      "canonical_name": "Atlas",
      "label": "product",
      "aliases": [
        "Atlas",
        "飞书数据平台 Atlas"
      ],
      "source_entity_ids": [
        "ef-6"
      ],
      "source_runs": [
        "run-20260417-150000-demo"
      ],
      "last_seen_at": "2026-04-17T07:33:08+00:00"
    },
    {
      "graph_entity_id": "g-entity-0007",
      "canonical_name": "5 月",
      "label": "time",
      "aliases": [
        "5 月"
      ],
      "source_entity_ids": [
        "ef-7"
      ],
      "source_runs": [
        "run-20260417-150000-demo"
      ],
      "last_seen_at": "2026-04-17T07:33:08+00:00"
    },
    {
      "graph_entity_id": "g-entity-0008",
      "canonical_name": "飞书数据团队",
      "label": "department",
      "aliases": [
        "飞书数据团队"
      ],
      "source_entity_ids": [
        "ef-8"
      ],
      "source_runs": [
        "run-20260417-150000-demo"
      ],
      "last_seen_at": "2026-04-17T07:33:08+00:00"
    },
    {
      "graph_entity_id": "g-entity-0009",
      "canonical_name": "企业知识检索",
      "label": "technology",
      "aliases": [
        "企业知识检索"
      ],
      "source_entity_ids": [
        "ef-9"
      ],
      "source_runs": [
        "run-20260417-150000-demo"
      ],
      "last_seen_at": "2026-04-17T07:33:08+00:00"
    },
    {
      "graph_entity_id": "g-entity-0010",
      "canonical_name": "Ashish Vaswani",
      "label": "person",
      "aliases": [
        "Ashish Vaswani"
      ],
      "source_entity_ids": [
        "ef-01"
      ],
      "source_runs": [
        "run-20260417-204500-attention-paper-fine"
      ],
      "last_seen_at": "2026-04-17T12:44:26+00:00"
    },
    {
      "graph_entity_id": "g-entity-0011",
      "canonical_name": "Noam Shazeer",
      "label": "person",
      "aliases": [
        "Noam Shazeer"
      ],
      "source_entity_ids": [
        "ef-02"
      ],
      "source_runs": [
        "run-20260417-204500-attention-paper-fine"
      ],
      "last_seen_at": "2026-04-17T12:44:26+00:00"
    },
    {
      "graph_entity_id": "g-entity-0012",
      "canonical_name": "Niki Parmar",
      "label": "person",
      "aliases": [
        "Niki Parmar"
      ],
      "source_entity_ids": [
        "ef-03"
      ],
      "source_runs": [
        "run-20260417-204500-attention-paper-fine"
      ],
      "last_seen_at": "2026-04-17T12:44:26+00:00"
    },
    {
      "graph_entity_id": "g-entity-0013",
      "canonical_name": "Jakob Uszkoreit",
      "label": "person",
      "aliases": [
        "Jakob Uszkoreit"
      ],
      "source_entity_ids": [
        "ef-04"
      ],
      "source_runs": [
        "run-20260417-204500-attention-paper-fine"
      ],
      "last_seen_at": "2026-04-17T12:44:26+00:00"
    },
    {
      "graph_entity_id": "g-entity-0014",
      "canonical_name": "Llion Jones",
      "label": "person",
      "aliases": [
        "Llion Jones"
      ],
      "source_entity_ids": [
        "ef-05"
      ],
      "source_runs": [
        "run-20260417-204500-attention-paper-fine"
      ],
      "last_seen_at": "2026-04-17T12:44:26+00:00"
    },
    {
      "graph_entity_id": "g-entity-0015",
      "canonical_name": "Aidan N. Gomez",
      "label": "person",
      "aliases": [
        "Aidan N. Gomez"
      ],
      "source_entity_ids": [
        "ef-06"
      ],
      "source_runs": [
        "run-20260417-204500-attention-paper-fine"
      ],
      "last_seen_at": "2026-04-17T12:44:26+00:00"
    },
    {
      "graph_entity_id": "g-entity-0016",
      "canonical_name": "Łukasz Kaiser",
      "label": "person",
      "aliases": [
        "Łukasz Kaiser"
      ],
      "source_entity_ids": [
        "ef-07"
      ],
      "source_runs": [
        "run-20260417-204500-attention-paper-fine"
      ],
      "last_seen_at": "2026-04-17T12:44:26+00:00"
    },
    {
      "graph_entity_id": "g-entity-0017",
      "canonical_name": "Illia Polosukhin",
      "label": "person",
      "aliases": [
        "Illia Polosukhin"
      ],
      "source_entity_ids": [
        "ef-08"
      ],
      "source_runs": [
        "run-20260417-204500-attention-paper-fine"
      ],
      "last_seen_at": "2026-04-17T12:44:26+00:00"
    },
    {
      "graph_entity_id": "g-entity-0018",
      "canonical_name": "Google Brain",
      "label": "organization",
      "aliases": [
        "Google Brain"
      ],
      "source_entity_ids": [
        "ef-09"
      ],
      "source_runs": [
        "run-20260417-204500-attention-paper-fine"
      ],
      "last_seen_at": "2026-04-17T12:44:26+00:00"
    },
    {
      "graph_entity_id": "g-entity-0019",
      "canonical_name": "Google Research",
      "label": "organization",
      "aliases": [
        "Google Research"
      ],
      "source_entity_ids": [
        "ef-10"
      ],
      "source_runs": [
        "run-20260417-204500-attention-paper-fine"
      ],
      "last_seen_at": "2026-04-17T12:44:26+00:00"
    },
    {
      "graph_entity_id": "g-entity-0020",
      "canonical_name": "University of Toronto",
      "label": "organization",
      "aliases": [
        "University of Toronto"
      ],
      "source_entity_ids": [
        "ef-11"
      ],
      "source_runs": [
        "run-20260417-204500-attention-paper-fine"
      ],
      "last_seen_at": "2026-04-17T12:44:26+00:00"
    },
    {
      "graph_entity_id": "g-entity-0021",
      "canonical_name": "Transformer",
      "label": "product",
      "aliases": [
        "Transformer",
        "our model",
        "the Transformer"
      ],
      "source_entity_ids": [
        "ef-12"
      ],
      "source_runs": [
        "run-20260417-204500-attention-paper-fine"
      ],
      "last_seen_at": "2026-04-17T12:44:26+00:00"
    },
    {
      "graph_entity_id": "g-entity-0022",
      "canonical_name": "Transformer (big)",
      "label": "product",
      "aliases": [
        "Transformer (big)",
        "big model",
        "big transformer model"
      ],
      "source_entity_ids": [
        "ef-13"
      ],
      "source_runs": [
        "run-20260417-204500-attention-paper-fine"
      ],
      "last_seen_at": "2026-04-17T12:44:26+00:00"
    },
    {
      "graph_entity_id": "g-entity-0023",
      "canonical_name": "Extended Neural GPU",
      "label": "product",
      "aliases": [
        "Extended Neural GPU"
      ],
      "source_entity_ids": [
        "ef-14"
      ],
      "source_runs": [
        "run-20260417-204500-attention-paper-fine"
      ],
      "last_seen_at": "2026-04-17T12:44:26+00:00"
    },
    {
      "graph_entity_id": "g-entity-0024",
      "canonical_name": "ByteNet",
      "label": "product",
      "aliases": [
        "ByteNet"
      ],
      "source_entity_ids": [
        "ef-15"
      ],
      "source_runs": [
        "run-20260417-204500-attention-paper-fine"
      ],
      "last_seen_at": "2026-04-17T12:44:26+00:00"
    },
    {
      "graph_entity_id": "g-entity-0025",
      "canonical_name": "ConvS2S",
      "label": "product",
      "aliases": [
        "ConvS2S"
      ],
      "source_entity_ids": [
        "ef-16"
      ],
      "source_runs": [
        "run-20260417-204500-attention-paper-fine"
      ],
      "last_seen_at": "2026-04-17T12:44:26+00:00"
    },
    {
      "graph_entity_id": "g-entity-0026",
      "canonical_name": "WMT 2014 English-to-German translation task",
      "label": "event",
      "aliases": [
        "WMT 2014 English-to-German translation task"
      ],
      "source_entity_ids": [
        "ef-17"
      ],
      "source_runs": [
        "run-20260417-204500-attention-paper-fine"
      ],
      "last_seen_at": "2026-04-17T12:44:26+00:00"
    },
    {
      "graph_entity_id": "g-entity-0027",
      "canonical_name": "WMT 2014 English-to-French translation task",
      "label": "event",
      "aliases": [
        "WMT 2014 English-to-French translation task"
      ],
      "source_entity_ids": [
        "ef-18"
      ],
      "source_runs": [
        "run-20260417-204500-attention-paper-fine"
      ],
      "last_seen_at": "2026-04-17T12:44:26+00:00"
    },
    {
      "graph_entity_id": "g-entity-0028",
      "canonical_name": "attention mechanism",
      "label": "technology",
      "aliases": [
        "attention mechanism",
        "attention mechanisms"
      ],
      "source_entity_ids": [
        "ef-19"
      ],